{"candidateHarnessVersionId":"hv-sha256:4d16c0eae8fce973187a26c43ba44a52ab32a539619e278d7c38eb375cdb5089","capabilities":{"datasetRole":"synthetic_development","deploymentAccess":false,"finalAccess":false,"gateAccess":false,"oracleAccess":false,"promotionAccess":false,"providerClass":"deterministic_fake","toolClass":"immutable_builtin"},"changeSurface":{"capabilityIdsAdded":[],"capabilityIdsRemoved":[],"changedComponentCount":1,"expandedClosureEditBytes":633,"structuralEditOperations":1},"developmentOnly":true,"dryRunRecordHash":"sha256:c15b27c3c551b8689d0c26db70d724a2bc3372c1b3636fdf8ac707de983c489a","parentHarnessVersionId":"hv-sha256:41691e5ba96081a7bb0d2d3bce93402d643a21a0b3c5a637a43e7c9715d87f33","promotable":false,"requestHash":"sha256:9f8ff2abdf4f270be3af47013df41f87f70b0c614ff94a3e5b8cdc676d98ff3c","requestId":"development-evaluator-request.evidence-v1","schemaVersion":1,"selectedComponentType":"WorkflowPolicy","tasks":[{"candidatePassed":true,"parentPassed":false,"taskId":"synthetic-task.changed-path","taskInputHash":"sha256:63fd473a2ffa81f65cc079430554979263be6ac758f300895c45076f3359e03b"},{"candidatePassed":true,"parentPassed":true,"taskId":"synthetic-task.preservation-path","taskInputHash":"sha256:ec74925b32400bae66ee6cd2b9c452d4eb500f42416fe36fb6b5a4716b38a8e3"}]}
